{
  "version": 2,
  "generatedAt": "2026-09-15T10:36:39Z",
  "academicYear": "2025-2026",
  "programId": "ingineria-informatiei-in-limba-maghiara",
  "year": 1,
  "group": 1411,
  "lastUpdatedAtSource": "2026-05-21",
  "days": [
    {
      "day": "monday",
      "entries": [
        {
          "time": "14–16",
          "frequency": "week1",
          "course": "Structuri de date",
          "type": "lab",
          "room": "DC401",
          "instructor": "Lect. PATCAS Csaba",
          "audience": {
            "formation": "IIM1",
            "scope": "cohort",
            "expectedScope": "subgroup",
            "isStandard": false
          },
          "roomAddress": "Univ Dimitrie Cantemir, etaj 4 (str. Teodor Mihali nr. 56)"
        }
      ]
    },
    {
      "day": "tuesday",
      "entries": [
        {
          "time": "8–10",
          "frequency": "weekly",
          "course": "Baze de date",
          "type": "lab",
          "room": "L404",
          "instructor": "Drd. KEPES Tamas",
          "audience": {
            "formation": "IIM1",
            "scope": "cohort",
            "expectedScope": "subgroup",
            "isStandard": false
          },
          "roomAddress": "Lab IoT - Cladirea FSEGA, etaj 4 (str. Teodor Mihali, nr. 58-60)"
        },
        {
          "time": "16–18",
          "frequency": "weekly",
          "course": "Programare orientata obiect",
          "type": "lecture",
          "room": "6/II",
          "instructor": "Conf. DARVAY Zsolt",
          "audience": {
            "formation": "IIM1",
            "scope": "cohort",
            "expectedScope": "cohort",
            "isStandard": true
          },
          "roomAddress": "Sala Gheorghe Calugareanu - Cladirea Centrala UBB, Etaj 2 (str. M Kogalniceanu,"
        },
        {
          "time": "18–20",
          "frequency": "weekly",
          "course": "Structuri de date",
          "type": "lecture",
          "room": "6/II",
          "instructor": "Lect. PATCAS Csaba",
          "audience": {
            "formation": "IIM1",
            "scope": "cohort",
            "expectedScope": "cohort",
            "isStandard": true
          },
          "roomAddress": "Sala Gheorghe Calugareanu - Cladirea Centrala UBB, Etaj 2 (str. M Kogalniceanu,"
        }
      ]
    },
    {
      "day": "wednesday",
      "entries": [
        {
          "time": "8–10",
          "frequency": "week2",
          "course": "Baze de date",
          "type": "seminar",
          "room": "gamma",
          "instructor": "Lect. DOKA MOLNAR Andrea",
          "audience": {
            "formation": "IIM1",
            "scope": "cohort",
            "expectedScope": "group",
            "isStandard": false
          },
          "roomAddress": "Cladirea Mathematica (str. Ploiesti, nr. 23-25)"
        },
        {
          "time": "10–13",
          "frequency": "weekly",
          "course": "Electrotehnica",
          "type": "lecture",
          "room": "Multimedia",
          "instructor": "Conf. LIBAL Andras",
          "audience": {
            "formation": "IIM1",
            "scope": "cohort",
            "expectedScope": "cohort",
            "isStandard": true
          },
          "roomAddress": "Cladirea Mathematica (str. Ploiesti, nr. 23-25)"
        },
        {
          "time": "13–14",
          "frequency": "weekly",
          "course": "Electrotehnica",
          "type": "lab",
          "room": "Multimedia",
          "instructor": "Conf. LIBAL Andras",
          "audience": {
            "formation": "IIM1",
            "scope": "cohort",
            "expectedScope": "subgroup",
            "isStandard": false
          },
          "roomAddress": "Cladirea Mathematica (str. Ploiesti, nr. 23-25)"
        },
        {
          "time": "14–16",
          "frequency": "weekly",
          "course": "Baze de date",
          "type": "lecture",
          "room": "C335",
          "instructor": "Lect. DOKA MOLNAR Andrea",
          "audience": {
            "formation": "IIM1",
            "scope": "cohort",
            "expectedScope": "cohort",
            "isStandard": true
          },
          "roomAddress": "Cladirea FSEGA, etaj 3 (str. Teodor Mihali, nr. 58-60)"
        },
        {
          "time": "16–18",
          "frequency": "week2",
          "course": "Programare orientata obiect",
          "type": "seminar",
          "room": "L001",
          "instructor": "Lect. SZENKOVITS Annamaria",
          "audience": {
            "formation": "IIM1",
            "scope": "cohort",
            "expectedScope": "group",
            "isStandard": false
          },
          "roomAddress": "Cladirea FSEGA, demisol (str. Teodor Mihali, nr. 58-60)"
        }
      ]
    },
    {
      "day": "thursday",
      "entries": [
        {
          "time": "8–10",
          "frequency": "weekly",
          "course": "Programare orientata obiect",
          "type": "lab",
          "room": "e",
          "instructor": "Lect. SZOLLOSI Istvan",
          "audience": {
            "formation": "IIM1",
            "scope": "cohort",
            "expectedScope": "subgroup",
            "isStandard": false
          },
          "roomAddress": "Cladirea Mathematica, Etaj 1 (str. Ploiesti, nr. 23-25)"
        },
        {
          "time": "10–12",
          "frequency": "weekly",
          "course": "Geometrie",
          "type": "seminar",
          "room": "A311",
          "instructor": "Lect. MEZEI Ildiko",
          "audience": {
            "formation": "IIM1",
            "scope": "cohort",
            "expectedScope": "group",
            "isStandard": false
          },
          "roomAddress": "cladirea Avram Iancu, etaj 3 (Str. A. Iancu)"
        },
        {
          "time": "12–14",
          "frequency": "weekly",
          "course": "Geometrie",
          "type": "lecture",
          "room": "2/I",
          "instructor": "Lect. MEZEI Ildiko",
          "audience": {
            "formation": "IIM1",
            "scope": "cohort",
            "expectedScope": "cohort",
            "isStandard": true
          },
          "roomAddress": "Sala Nicolae Iorga - Cladirea Centrala UBB, Etaj 1 (str. M Kogalniceanu, nr. 1)"
        }
      ]
    },
    {
      "day": "friday",
      "entries": [
        {
          "time": "8–10",
          "frequency": "weekly",
          "course": "Sisteme de operare",
          "type": "lecture",
          "room": "AVM",
          "instructor": "Lect. RUFF Laura",
          "audience": {
            "formation": "IIM1",
            "scope": "cohort",
            "expectedScope": "cohort",
            "isStandard": true
          },
          "roomAddress": "Amf Victor Marian Maior - Facultatea de Fizica, Clad Centrala UBB, Et 2 (str. M"
        },
        {
          "time": "12–14",
          "frequency": "weekly",
          "course": "Sisteme de operare",
          "type": "lab",
          "room": "Multimedia",
          "instructor": "Lect. MOLNAR Botond",
          "audience": {
            "formation": "IIM1",
            "scope": "cohort",
            "expectedScope": "subgroup",
            "isStandard": false
          },
          "roomAddress": "Cladirea Mathematica (str. Ploiesti, nr. 23-25)"
        },
        {
          "time": "14–16",
          "frequency": "weekly",
          "course": "Structuri de date",
          "type": "seminar",
          "room": "lambda",
          "instructor": "Lect. PATCAS Csaba",
          "audience": {
            "formation": "IIM1",
            "scope": "cohort",
            "expectedScope": "group",
            "isStandard": false
          },
          "roomAddress": "Cladirea Mathematica (str. Ploiesti, nr. 23-25)"
        }
      ]
    }
  ]
}
