{
  "version": 2,
  "generatedAt": "2026-10-31T11:20:54Z",
  "academicYear": "2026-2027",
  "programId": "informatica-in-limba-engleza",
  "year": 1,
  "group": 914,
  "lastUpdatedAtSource": "2026-10-19",
  "days": [
    {
      "day": "monday",
      "entries": [
        {
          "time": "8–10",
          "frequency": "week2",
          "course": "Arhitectura sistemelor de calcul",
          "type": "seminar",
          "room": "DC405",
          "instructor": "Lect. CALIN Alina",
          "audience": {
            "formation": "914",
            "scope": "group",
            "expectedScope": "group",
            "isStandard": true
          },
          "roomAddress": "Univ Dimitrie Cantemir, etaj 4 (str. Teodor Mihali nr. 56)"
        },
        {
          "time": "18–20",
          "frequency": "weekly",
          "course": "Arhitectura sistemelor de calcul",
          "type": "lab",
          "room": "S01",
          "instructor": "C.d.asociat BOAMBA Emilia",
          "audience": {
            "formation": "914/2",
            "scope": "subgroup",
            "expectedScope": "subgroup",
            "isStandard": true
          },
          "roomAddress": "Cladirea FSEGA, demisol (str. Teodor Mihali, nr. 58-60)"
        }
      ]
    },
    {
      "day": "tuesday",
      "entries": [
        {
          "time": "8–10",
          "frequency": "weekly",
          "course": "Algebra",
          "type": "seminar",
          "room": "DC401",
          "instructor": "Drd. POP Robert",
          "audience": {
            "formation": "914",
            "scope": "group",
            "expectedScope": "group",
            "isStandard": true
          },
          "roomAddress": "Univ Dimitrie Cantemir, etaj 4 (str. Teodor Mihali nr. 56)"
        },
        {
          "time": "10–12",
          "frequency": "weekly",
          "course": "Fundamentele programarii",
          "type": "lab",
          "room": "L320",
          "instructor": "C.d.asociat GALBIN Andreea",
          "audience": {
            "formation": "914/1",
            "scope": "subgroup",
            "expectedScope": "subgroup",
            "isStandard": true
          },
          "roomAddress": "Cladirea FSEGA, etaj 3 (str. Teodor Mihali, nr. 58-60)"
        },
        {
          "time": "12–14",
          "frequency": "weekly",
          "course": "Logica computationala",
          "type": "seminar",
          "room": "DC402",
          "instructor": "Asist. ALBU Alexandra",
          "audience": {
            "formation": "914",
            "scope": "group",
            "expectedScope": "group",
            "isStandard": true
          },
          "roomAddress": "Univ Dimitrie Cantemir, etaj 4 (str. Teodor Mihali nr. 56)"
        }
      ]
    },
    {
      "day": "wednesday",
      "entries": [
        {
          "time": "8–10",
          "frequency": "weekly",
          "course": "Algebra",
          "type": "lecture",
          "room": "C036",
          "instructor": "Prof. CRIVEI Septimiu",
          "audience": {
            "formation": "IE1",
            "scope": "cohort",
            "expectedScope": "cohort",
            "isStandard": true
          },
          "roomAddress": "Amfiteatru Cladirea FSEGA (str. Teodor Mihali, nr. 58-60)"
        },
        {
          "time": "10–12",
          "frequency": "weekly",
          "course": "Logica computationala",
          "type": "lecture",
          "room": "C036",
          "instructor": "Conf. LUPEA Mihaiela",
          "audience": {
            "formation": "IE1",
            "scope": "cohort",
            "expectedScope": "cohort",
            "isStandard": true
          },
          "roomAddress": "Amfiteatru Cladirea FSEGA (str. Teodor Mihali, nr. 58-60)"
        },
        {
          "time": "12–14",
          "frequency": "weekly",
          "course": "Arhitectura sistemelor de calcul",
          "type": "lab",
          "room": "L001",
          "instructor": "C.d.asociat LECHINTAN Tudor",
          "audience": {
            "formation": "914/1",
            "scope": "subgroup",
            "expectedScope": "subgroup",
            "isStandard": true
          },
          "roomAddress": "Cladirea FSEGA, demisol (str. Teodor Mihali, nr. 58-60)"
        },
        {
          "time": "16–18",
          "frequency": "weekly",
          "course": "Fundamentele programarii",
          "type": "lab",
          "room": "DC508",
          "instructor": "C.d.asociat MIHIS Alin",
          "audience": {
            "formation": "914/2",
            "scope": "subgroup",
            "expectedScope": "subgroup",
            "isStandard": true
          },
          "roomAddress": "Univ Dimitrie Cantemir, etaj 5 (str. Teodor Mihali nr. 56)"
        }
      ]
    },
    {
      "day": "thursday",
      "entries": [
        {
          "time": "12–14",
          "frequency": "weekly",
          "course": "Analiza matematica",
          "type": "seminar",
          "room": "DC405",
          "instructor": "Lect. NECHITA Mihai",
          "audience": {
            "formation": "914",
            "scope": "group",
            "expectedScope": "group",
            "isStandard": true
          },
          "roomAddress": "Univ Dimitrie Cantemir, etaj 4 (str. Teodor Mihali nr. 56)"
        },
        {
          "time": "14–16",
          "frequency": "weekly",
          "course": "Analiza matematica",
          "type": "lecture",
          "room": "C036",
          "instructor": "Lect. NECHITA Mihai",
          "audience": {
            "formation": "IE1",
            "scope": "cohort",
            "expectedScope": "cohort",
            "isStandard": true
          },
          "roomAddress": "Amfiteatru Cladirea FSEGA (str. Teodor Mihali, nr. 58-60)"
        },
        {
          "time": "16–18",
          "frequency": "weekly",
          "course": "Arhitectura sistemelor de calcul",
          "type": "lecture",
          "room": "C036",
          "instructor": "Conf. SUCIU Mihai",
          "audience": {
            "formation": "IE1",
            "scope": "cohort",
            "expectedScope": "cohort",
            "isStandard": true
          },
          "roomAddress": "Amfiteatru Cladirea FSEGA (str. Teodor Mihali, nr. 58-60)"
        },
        {
          "time": "18–20",
          "frequency": "weekly",
          "course": "Fundamentele programarii",
          "type": "lecture",
          "room": "C036",
          "instructor": "Conf. MOLNAR Arthur",
          "audience": {
            "formation": "IE1",
            "scope": "cohort",
            "expectedScope": "cohort",
            "isStandard": true
          },
          "roomAddress": "Amfiteatru Cladirea FSEGA (str. Teodor Mihali, nr. 58-60)"
        }
      ]
    },
    {
      "day": "friday",
      "entries": [
        {
          "time": "8–9",
          "frequency": "weekly",
          "course": "Programare in C",
          "type": "lecture",
          "room": "C036",
          "instructor": "Lect. MIRCEA Ioan Gabriel",
          "audience": {
            "formation": "IE1",
            "scope": "cohort",
            "expectedScope": "cohort",
            "isStandard": true
          },
          "roomAddress": "Amfiteatru Cladirea FSEGA (str. Teodor Mihali, nr. 58-60)"
        },
        {
          "time": "8–10",
          "frequency": "weekly",
          "course": "Fundamentele programarii",
          "type": "seminar",
          "room": "DC403",
          "instructor": "Lect. POP Andreea",
          "audience": {
            "formation": "914",
            "scope": "group",
            "expectedScope": "group",
            "isStandard": true
          },
          "roomAddress": "Univ Dimitrie Cantemir, etaj 4 (str. Teodor Mihali nr. 56)"
        },
        {
          "time": "12–14",
          "frequency": "weekly",
          "course": "Psihologie educationala",
          "type": "lecture",
          "room": "2/I",
          "instructor": "Lect. DUMULESCU Daniela",
          "audience": {
            "formation": "IE1",
            "scope": "cohort",
            "expectedScope": "cohort",
            "isStandard": true
          },
          "roomAddress": "Sala Nicolae Iorga - Cladirea Centrala UBB, Etaj 1 (str. M Kogalniceanu, nr. 1)"
        },
        {
          "time": "14–16",
          "frequency": "weekly",
          "course": "Psihologie educationala",
          "type": "seminar",
          "room": "2/I",
          "instructor": "Lect. DUMULESCU Daniela",
          "audience": {
            "formation": "IE1",
            "scope": "cohort",
            "expectedScope": "group",
            "isStandard": false
          },
          "roomAddress": "Sala Nicolae Iorga - Cladirea Centrala UBB, Etaj 1 (str. M Kogalniceanu, nr. 1)"
        },
        {
          "time": "16–18",
          "frequency": "weekly",
          "course": "Programare in C",
          "type": "lab",
          "room": "L402",
          "instructor": "Lect. MIRCEA Ioan Gabriel",
          "audience": {
            "formation": "IE1",
            "scope": "cohort",
            "expectedScope": "subgroup",
            "isStandard": false
          },
          "roomAddress": "Cladirea FSEGA, etaj 4 (str. Teodor Mihali, nr. 58-60)"
        }
      ]
    }
  ]
}
