{
  "version": 2,
  "generatedAt": "2026-10-31T11:20:54Z",
  "academicYear": "2026-2027",
  "programId": "informatica-linia-de-studiu-romana",
  "year": 1,
  "group": 215,
  "lastUpdatedAtSource": "2026-10-19",
  "days": [
    {
      "day": "monday",
      "entries": [
        {
          "time": "12–14",
          "frequency": "weekly",
          "course": "Arhitectura sistemelor de calcul",
          "type": "lab",
          "room": "L320",
          "instructor": "C.d.asociat MARGINEAN Tiberius",
          "audience": {
            "formation": "215/2",
            "scope": "subgroup",
            "expectedScope": "subgroup",
            "isStandard": true
          },
          "roomAddress": "Cladirea FSEGA, etaj 3 (str. Teodor Mihali, nr. 58-60)"
        }
      ]
    },
    {
      "day": "tuesday",
      "entries": [
        {
          "time": "10–12",
          "frequency": "weekly",
          "course": "Analiza matematica",
          "type": "seminar",
          "room": "C510",
          "instructor": "Drd. ARON Mihai Alexandru",
          "audience": {
            "formation": "215",
            "scope": "group",
            "expectedScope": "group",
            "isStandard": true
          },
          "roomAddress": "Cladirea FSEGA, etaj 5 (str. Teodor Mihali, nr. 58-60)"
        },
        {
          "time": "16–18",
          "frequency": "weekly",
          "course": "Algebra",
          "type": "seminar",
          "room": "A311",
          "instructor": "Conf. PELEA Cosmin",
          "audience": {
            "formation": "215",
            "scope": "group",
            "expectedScope": "group",
            "isStandard": true
          },
          "roomAddress": "cladirea Avram Iancu, etaj 3 (Str. A. Iancu)"
        }
      ]
    },
    {
      "day": "wednesday",
      "entries": [
        {
          "time": "12–14",
          "frequency": "weekly",
          "course": "Fundamentele programarii",
          "type": "lab",
          "room": "L321",
          "instructor": "Lect. MAIER Mariana",
          "audience": {
            "formation": "215/1",
            "scope": "subgroup",
            "expectedScope": "subgroup",
            "isStandard": true
          },
          "roomAddress": "Cladirea FSEGA, etaj 3 (str. Teodor Mihali, nr. 58-60)"
        },
        {
          "time": "14–16",
          "frequency": "weekly",
          "course": "Fundamentele programarii",
          "type": "seminar",
          "room": "DC405",
          "instructor": "Lect. MIRCEA Ioan Gabriel",
          "audience": {
            "formation": "215",
            "scope": "group",
            "expectedScope": "group",
            "isStandard": true
          },
          "roomAddress": "Univ Dimitrie Cantemir, etaj 4 (str. Teodor Mihali nr. 56)"
        },
        {
          "time": "16–18",
          "frequency": "weekly",
          "course": "Analiza matematica",
          "type": "lecture",
          "room": "C036",
          "instructor": "Lect. BERINDE Stefan",
          "audience": {
            "formation": "I1",
            "scope": "cohort",
            "expectedScope": "cohort",
            "isStandard": true
          },
          "roomAddress": "Amfiteatru Cladirea FSEGA (str. Teodor Mihali, nr. 58-60)"
        },
        {
          "time": "18–20",
          "frequency": "weekly",
          "course": "Arhitectura sistemelor de calcul",
          "type": "lecture",
          "room": "C036",
          "instructor": "Lect. VANCEA Alexandru",
          "audience": {
            "formation": "I1",
            "scope": "cohort",
            "expectedScope": "cohort",
            "isStandard": true
          },
          "roomAddress": "Amfiteatru Cladirea FSEGA (str. Teodor Mihali, nr. 58-60)"
        }
      ]
    },
    {
      "day": "thursday",
      "entries": [
        {
          "time": "8–10",
          "frequency": "weekly",
          "course": "Algebra",
          "type": "lecture",
          "room": "C036",
          "instructor": "Conf. MODOI Gheorghe Ciprian",
          "audience": {
            "formation": "I1",
            "scope": "cohort",
            "expectedScope": "cohort",
            "isStandard": true
          },
          "roomAddress": "Amfiteatru Cladirea FSEGA (str. Teodor Mihali, nr. 58-60)"
        },
        {
          "time": "10–12",
          "frequency": "weekly",
          "course": "Fundamentele programarii",
          "type": "lecture",
          "room": "C036",
          "instructor": "Prof. CZIBULA Istvan",
          "audience": {
            "formation": "I1",
            "scope": "cohort",
            "expectedScope": "cohort",
            "isStandard": true
          },
          "roomAddress": "Amfiteatru Cladirea FSEGA (str. Teodor Mihali, nr. 58-60)"
        },
        {
          "time": "12–14",
          "frequency": "weekly",
          "course": "Logica computationala",
          "type": "lecture",
          "room": "C036",
          "instructor": "Lect. POP Andreea",
          "audience": {
            "formation": "I1",
            "scope": "cohort",
            "expectedScope": "cohort",
            "isStandard": true
          },
          "roomAddress": "Amfiteatru Cladirea FSEGA (str. Teodor Mihali, nr. 58-60)"
        },
        {
          "time": "14–16",
          "frequency": "week1",
          "course": "Arhitectura sistemelor de calcul",
          "type": "seminar",
          "room": "C510",
          "instructor": "Drd. BOTA Daniel",
          "audience": {
            "formation": "215",
            "scope": "group",
            "expectedScope": "group",
            "isStandard": true
          },
          "roomAddress": "Cladirea FSEGA, etaj 5 (str. Teodor Mihali, nr. 58-60)"
        }
      ]
    },
    {
      "day": "friday",
      "entries": [
        {
          "time": "8–9",
          "frequency": "weekly",
          "course": "Programare in C",
          "type": "lecture",
          "room": "C036",
          "instructor": "Lect. MIRCEA Ioan Gabriel",
          "audience": {
            "formation": "I1",
            "scope": "cohort",
            "expectedScope": "cohort",
            "isStandard": true
          },
          "roomAddress": "Amfiteatru Cladirea FSEGA (str. Teodor Mihali, nr. 58-60)"
        },
        {
          "time": "10–12",
          "frequency": "weekly",
          "course": "Programare in C",
          "type": "lab",
          "room": "L402",
          "instructor": "Lect. MIRCEA Ioan Gabriel",
          "audience": {
            "formation": "I1",
            "scope": "cohort",
            "expectedScope": "subgroup",
            "isStandard": false
          },
          "roomAddress": "Cladirea FSEGA, etaj 4 (str. Teodor Mihali, nr. 58-60)"
        },
        {
          "time": "12–14",
          "frequency": "weekly",
          "course": "Psihologie educationala",
          "type": "lecture",
          "room": "2/I",
          "instructor": "Lect. DUMULESCU Daniela",
          "audience": {
            "formation": "I1",
            "scope": "cohort",
            "expectedScope": "cohort",
            "isStandard": true
          },
          "roomAddress": "Sala Nicolae Iorga - Cladirea Centrala UBB, Etaj 1 (str. M Kogalniceanu, nr. 1)"
        },
        {
          "time": "12–14",
          "frequency": "weekly",
          "course": "Arhitectura sistemelor de calcul",
          "type": "lab",
          "room": "L320",
          "instructor": "C.d.asociat UILACAN Roxana",
          "audience": {
            "formation": "215/1",
            "scope": "subgroup",
            "expectedScope": "subgroup",
            "isStandard": true
          },
          "roomAddress": "Cladirea FSEGA, etaj 3 (str. Teodor Mihali, nr. 58-60)"
        },
        {
          "time": "14–16",
          "frequency": "weekly",
          "course": "Psihologie educationala",
          "type": "seminar",
          "room": "2/I",
          "instructor": "Lect. DUMULESCU Daniela",
          "audience": {
            "formation": "I1",
            "scope": "cohort",
            "expectedScope": "group",
            "isStandard": false
          },
          "roomAddress": "Sala Nicolae Iorga - Cladirea Centrala UBB, Etaj 1 (str. M Kogalniceanu, nr. 1)"
        },
        {
          "time": "14–16",
          "frequency": "weekly",
          "course": "Logica computationala",
          "type": "seminar",
          "room": "DC403",
          "instructor": "Lect. POP Andreea",
          "audience": {
            "formation": "215",
            "scope": "group",
            "expectedScope": "group",
            "isStandard": true
          },
          "roomAddress": "Univ Dimitrie Cantemir, etaj 4 (str. Teodor Mihali nr. 56)"
        },
        {
          "time": "16–18",
          "frequency": "weekly",
          "course": "Fundamentele programarii",
          "type": "lab",
          "room": "DC506",
          "instructor": "Lect. BARA Paul",
          "audience": {
            "formation": "215/2",
            "scope": "subgroup",
            "expectedScope": "subgroup",
            "isStandard": true
          },
          "roomAddress": "Univ Dimitrie Cantemir, etaj 5 (str. Teodor Mihali nr. 56)"
        }
      ]
    }
  ]
}
